{
  "$schema": "../schemas/sources.schema.json",
  "generated_at": "2026-10-05T11:34:29+00:00",
  "generator": "scripts/crawl/verify_arxiv_papers.py",
  "verification_method": "arXiv Atom API title search + string-similarity confirmation",
  "records": 62,
  "sources": [
    {
      "id": "chain-of-thought-prompting-elicits-reasoning-in-large-language-m",
      "title": "Chain-of-Thought Prompting Elicits Reasoning in Large Language Models",
      "type": "research-paper",
      "url": "http://arxiv.org/abs/2201.11903v6",
      "arxiv": "2201.11903",
      "authors": [
        "Jason Wei",
        "Xuezhi Wang",
        "Dale Schuurmans",
        "Maarten Bosma",
        "Brian Ichter",
        "Fei Xia",
        "Ed Chi",
        "Quoc Le",
        "Denny Zhou"
      ],
      "author_count": 9,
      "organization": null,
      "published": "2022-01-28",
      "updated": "2023-01-10",
      "license": "arXiv non-exclusive distrib license (check per paper)",
      "category": "reasoning",
      "tags": [
        "chain-of-thought",
        "prompting",
        "reasoning"
      ],
      "summary": "We explore how generating a chain of thought -- a series of intermediate reasoning steps -- significantly improves the ability of large language models to perform complex reasoning. In particular, we show how such reasoning abilities emerge naturally in sufficiently large language models via a simple method called chain of thought prompting, where a few chain of thought demonstrations are provided as exemplars in prompting. Experiments on three large language models show that chain of thought prompting improves performance on a range of arithmetic, commonsense, and symbolic reasoning tasks. The empirical gains can be striking. For instance, prompting a 540B-parameter language model with just eight chain of thought exemplars achieves state of the art accuracy on the GSM8K benchmark of math word problems, surpassing even finetuned GPT-3 with a verifier.",
      "key_findings": [],
      "key_contribution": null,
      "limitations": [],
      "reproducibility": "unknown",
      "source_quality": 9,
      "authority": 9,
      "evidence": 8,
      "maintenance": "static",
      "adoption": "unknown",
      "relevance": "primary",
      "confidence": "very-high",
      "claim_type": "fact",
      "evidence_level": "verified-paper",
      "primary_category": "cs.CL",
      "comment": null,
      "journal_ref": null,
      "title_match_ratio": 1.0,
      "query_title": "Chain-of-Thought Prompting Elicits Reasoning in Large Language Models",
      "corroborated_by": [],
      "related_sources": [],
      "used_by": [],
      "provenance": {
        "content_class": "reference",
        "generated_by": "scripts/crawl/verify_arxiv_papers.py",
        "human_reviewed": false
      },
      "verified_at": "2026-10-05",
      "expires_at": "2027-10-05",
      "verification": {
        "url_reachable": true,
        "http_status": 200,
        "content_matches_description": true,
        "checked_by": "arXiv API title search",
        "notes": "returned title matches query at ratio 1.000"
      }
    },
    {
      "id": "self-consistency-improves-chain-of-thought-reasoning-in-language",
      "title": "Self-Consistency Improves Chain of Thought Reasoning in Language Models",
      "type": "research-paper",
      "url": "http://arxiv.org/abs/2203.11171v4",
      "arxiv": "2203.11171",
      "authors": [
        "Xuezhi Wang",
        "Jason Wei",
        "Dale Schuurmans",
        "Quoc Le",
        "Ed Chi",
        "Sharan Narang",
        "Aakanksha Chowdhery",
        "Denny Zhou"
      ],
      "author_count": 8,
      "organization": null,
      "published": "2022-03-21",
      "updated": "2023-03-07",
      "license": "arXiv non-exclusive distrib license (check per paper)",
      "category": "reasoning",
      "tags": [
        "self-consistency",
        "sampling",
        "reasoning"
      ],
      "summary": "Chain-of-thought prompting combined with pre-trained large language models has achieved encouraging results on complex reasoning tasks. In this paper, we propose a new decoding strategy, self-consistency, to replace the naive greedy decoding used in chain-of-thought prompting. It first samples a diverse set of reasoning paths instead of only taking the greedy one, and then selects the most consistent answer by marginalizing out the sampled reasoning paths. Self-consistency leverages the intuition that a complex reasoning problem typically admits multiple different ways of thinking leading to its unique correct answer. Our extensive empirical evaluation shows that self-consistency boosts the performance of chain-of-thought prompting with a striking margin on a range of popular arithmetic and commonsense reasoning benchmarks, including GSM8K (+17.9%), SVAMP (+11.0%), AQuA (+12.2%), StrategyQA (+6.4%) and ARC-challenge (+3.9%).",
      "key_findings": [],
      "key_contribution": null,
      "limitations": [],
      "reproducibility": "unknown",
      "source_quality": 9,
      "authority": 9,
      "evidence": 8,
      "maintenance": "static",
      "adoption": "unknown",
      "relevance": "primary",
      "confidence": "very-high",
      "claim_type": "fact",
      "evidence_level": "verified-paper",
      "primary_category": "cs.CL",
      "comment": "Published at ICLR 2023. V2: added PaLM results; V3: added UL2 results; V4: camera ready version at ICLR 2023",
      "journal_ref": null,
      "title_match_ratio": 1.0,
      "query_title": "Self-Consistency Improves Chain of Thought Reasoning in Language Models",
      "corroborated_by": [],
      "related_sources": [],
      "used_by": [],
      "provenance": {
        "content_class": "reference",
        "generated_by": "scripts/crawl/verify_arxiv_papers.py",
        "human_reviewed": false
      },
      "verified_at": "2026-10-05",
      "expires_at": "2027-10-05",
      "verification": {
        "url_reachable": true,
        "http_status": 200,
        "content_matches_description": true,
        "checked_by": "arXiv API title search",
        "notes": "returned title matches query at ratio 1.000"
      }
    },
    {
      "id": "tree-of-thoughts-deliberate-problem-solving-with-large-language-",
      "title": "Tree of Thoughts: Deliberate Problem Solving with Large Language Models",
      "type": "research-paper",
      "url": "http://arxiv.org/abs/2305.10601v2",
      "arxiv": "2305.10601",
      "authors": [
        "Shunyu Yao",
        "Dian Yu",
        "Jeffrey Zhao",
        "Izhak Shafran",
        "Thomas L. Griffiths",
        "Yuan Cao",
        "Karthik Narasimhan"
      ],
      "author_count": 7,
      "organization": null,
      "published": "2023-05-17",
      "updated": "2023-12-03",
      "license": "arXiv non-exclusive distrib license (check per paper)",
      "category": "reasoning",
      "tags": [
        "tree-search",
        "deliberate-search",
        "reasoning"
      ],
      "summary": "Language models are increasingly being deployed for general problem solving across a wide range of tasks, but are still confined to token-level, left-to-right decision-making processes during inference. This means they can fall short in tasks that require exploration, strategic lookahead, or where initial decisions play a pivotal role. To surmount these challenges, we introduce a new framework for language model inference, Tree of Thoughts (ToT), which generalizes over the popular Chain of Thought approach to prompting language models, and enables exploration over coherent units of text (thoughts) that serve as intermediate steps toward problem solving. ToT allows LMs to perform deliberate decision making by considering multiple different reasoning paths and self-evaluating choices to decide the next course of action, as well as looking ahead or backtracking when necessary to make global choices. Our experiments show that ToT significantly enhances language models' problem-solving abilities on three novel tasks requiring non-trivial planning or search: Game of 24, Creative Writing, and Mini Crosswords. For instance, in Game of 24, while GPT-4 with chain-of-thought prompting only so",
      "key_findings": [],
      "key_contribution": null,
      "limitations": [],
      "reproducibility": "unknown",
      "source_quality": 9,
      "authority": 9,
      "evidence": 8,
      "maintenance": "static",
      "adoption": "unknown",
      "relevance": "primary",
      "confidence": "very-high",
      "claim_type": "fact",
      "evidence_level": "verified-paper",
      "primary_category": "cs.CL",
      "comment": "NeurIPS 2023 camera ready version. Code repo with all prompts: https://github.com/princeton-nlp/tree-of-thought-llm",
      "journal_ref": null,
      "title_match_ratio": 1.0,
      "query_title": "Tree of Thoughts: Deliberate Problem Solving with Large Language Models",
      "corroborated_by": [],
      "related_sources": [],
      "used_by": [],
      "provenance": {
        "content_class": "reference",
        "generated_by": "scripts/crawl/verify_arxiv_papers.py",
        "human_reviewed": false
      },
      "verified_at": "2026-10-05",
      "expires_at": "2027-10-05",
      "verification": {
        "url_reachable": true,
        "http_status": 200,
        "content_matches_description": true,
        "checked_by": "arXiv API title search",
        "notes": "returned title matches query at ratio 1.000"
      }
    },
    {
      "id": "graph-of-thoughts-solving-elaborate-problems-with-large-language",
      "title": "Graph of Thoughts: Solving Elaborate Problems with Large Language Models",
      "type": "research-paper",
      "url": "http://arxiv.org/abs/2308.09687v4",
      "arxiv": "2308.09687",
      "authors": [
        "Maciej Besta",
        "Nils Blach",
        "Ales Kubicek",
        "Robert Gerstenberger",
        "Michal Podstawski",
        "Lukas Gianinazzi",
        "Joanna Gajda",
        "Tomasz Lehmann",